[
  {
    "id": "backstage-bleed",
    "name": "Backstage Bleed",
    "category": "content",
    "standard": "Plainspoken",
    "definition": "Present when any user-facing string contains an internal identifier — a template key, variable name, enum value, or interpolation syntax — instead of the human-readable value it stands for.",
    "symptom": "Machine vocabulary appears where a human word should be.",
    "detectable_from": [
      "screenshot",
      "content-text",
      "source+rendered"
    ],
    "fix_pattern": "Map every internal key to a display label at the boundary; lint for interpolation syntax, snake_case, and known enum tokens in rendered copy.",
    "refs": {
      "wcag": [],
      "other": [
        {
          "source_id": "nielsen-norman-group",
          "citation": "NN/g #2 Match between system and the real world (Jakob Nielsen, nngroup.com/articles/ten-usability-heuristics/)"
        }
      ]
    },
    "illustration": "Non-evidentiary illustration: A template renders 'No category-code items in this collection yet,' exposing an implementation key as user-facing copy."
  },
  {
    "id": "counted-in-crates",
    "name": "Counted in Crates",
    "category": "content",
    "standard": "Accurate",
    "definition": "Present when a displayed count tallies a different unit than the one the surrounding copy or the user's task implies (containers counted, contents claimed, or vice versa).",
    "symptom": "The number is technically true and humanly false.",
    "detectable_from": [
      "source+rendered"
    ],
    "fix_pattern": "Count in the unit the label names; if the unit must differ, change the label to name what is actually counted.",
    "refs": {
      "wcag": [],
      "other": [
        {
          "source_id": "nielsen-norman-group",
          "citation": "NN/g #2 Match between system and the real world (Jakob Nielsen, nngroup.com/articles/ten-usability-heuristics/)"
        },
        {
          "source_id": "gov-uk",
          "citation": "GOV.UK style guide A-Z: numbers"
        }
      ]
    },
    "illustration": "Non-evidentiary illustration: a count tallied parent groups while the surrounding task and labels described saved items."
  },
  {
    "id": "arithmetic-mirage",
    "name": "Arithmetic Mirage",
    "category": "content",
    "standard": "Accurate",
    "definition": "Present when numbers visible on one screen fail their own arithmetic — a '+N more' indicator, subtotal, or badge that contradicts the visible items or the stated total.",
    "symptom": "The overflow badge and the visible items do not add up to the set.",
    "detectable_from": [
      "screenshot",
      "source+rendered"
    ],
    "fix_pattern": "Derive overflow counts from the same source as the total (total minus visible), never from a second query or a hardcoded value.",
    "refs": {
      "wcag": [],
      "other": [
        {
          "source_id": "nielsen-norman-group",
          "citation": "NN/g #2 Match between system and the real world (Jakob Nielsen, nngroup.com/articles/ten-usability-heuristics/)"
        },
        {
          "source_id": "gov-uk",
          "citation": "GOV.UK style guide A-Z: numbers"
        }
      ]
    },
    "illustration": "Non-evidentiary illustration: a remainder label repeated the total instead of subtracting the visible cards."
  },
  {
    "id": "phantom-freshness",
    "name": "Phantom Freshness",
    "category": "content",
    "standard": "Accurate",
    "definition": "Present when metadata copy asserts a data-dependent fact (latest data, last updated, sync status) about an entity that contains no data, or when the assertion contradicts an adjacent zero-count on the same line.",
    "symptom": "An empty thing claims to be fresh.",
    "detectable_from": [
      "screenshot",
      "content-text"
    ],
    "fix_pattern": "Gate data-dependent metadata behind a data-exists check; empty states get empty-state copy, not vitals.",
    "refs": {
      "wcag": [],
      "other": [
        {
          "source_id": "nielsen-norman-group",
          "citation": "NN/g #2 Match between system and the real world (Jakob Nielsen, nngroup.com/articles/ten-usability-heuristics/)"
        }
      ]
    },
    "illustration": "Non-evidentiary illustration: an empty object claimed recent data despite having no data, and mixed date formats in the same line."
  },
  {
    "id": "scolding-machine",
    "name": "Scolding Machine",
    "category": "content",
    "standard": "Constructive",
    "definition": "Present when error copy blames the user, performs apology, or exposes machine internals — any of: 'you forgot', 'sorry', 'oops', 'please', 'valid'/'invalid', or a raw error code shown as the message.",
    "symptom": "The error talks about fault or internals instead of the fix.",
    "detectable_from": [
      "screenshot",
      "content-text"
    ],
    "fix_pattern": "State what happened and what to do next in neutral, specific terms; keep codes in logs, not copy.",
    "refs": {
      "wcag": [
        {
          "source_id": "wcag-2.2",
          "citation": "3.3.1 Error Identification (A)"
        },
        {
          "source_id": "wcag-2.2",
          "citation": "3.3.3 Error Suggestion (AA)"
        }
      ],
      "other": [
        {
          "source_id": "gov-uk",
          "citation": "GOV.UK error message component: banned words documented verbatim"
        },
        {
          "source_id": "apple-hig",
          "citation": "Apple HIG alerts: never title an alert 'Error'"
        },
        {
          "source_id": "nielsen-norman-group",
          "citation": "NN/g #9 Help users recognize, diagnose, and recover from errors (Jakob Nielsen, nngroup.com/articles/ten-usability-heuristics/)"
        }
      ]
    },
    "illustration": "Non-evidentiary illustration: 'error 0x0000000643' or 'you forgot to enter' — GOV.UK bans both patterns explicitly."
  },
  {
    "id": "foghorn-error",
    "name": "Foghorn Error",
    "category": "content",
    "standard": "Constructive",
    "definition": "Present when an error message could be pasted onto any other error in the product without losing accuracy — it names neither the item in error, the cause, nor a next step.",
    "symptom": "Loud that something is wrong, silent about what and where.",
    "detectable_from": [
      "screenshot",
      "content-text"
    ],
    "fix_pattern": "One message per failure mode: name the field or object, the condition violated, and the corrective action.",
    "refs": {
      "wcag": [
        {
          "source_id": "wcag-2.2",
          "citation": "3.3.1 Error Identification (A)"
        },
        {
          "source_id": "wcag-2.2",
          "citation": "3.3.3 Error Suggestion (AA)"
        }
      ],
      "other": [
        {
          "source_id": "gov-uk",
          "citation": "GOV.UK error message component: bans 'An error occurred' and 'This field is required'"
        },
        {
          "source_id": "nielsen-norman-group",
          "citation": "NN/g #9 Help users recognize, diagnose, and recover from errors (Jakob Nielsen, nngroup.com/articles/ten-usability-heuristics/)"
        },
        {
          "source_id": "shneiderman",
          "citation": "Shneiderman #5 Prevent errors"
        }
      ]
    },
    "illustration": "Non-evidentiary illustration: 'An error occurred' and 'This field is required' — both documented GOV.UK catch-all bans."
  },
  {
    "id": "blindfold-link",
    "name": "Blindfold Link",
    "category": "content",
    "standard": "Navigable",
    "definition": "Present when a link's text, read alone out of context, does not identify its destination or purpose — e.g. 'click here', 'more', 'learn more', a bare 'here'.",
    "symptom": "A list of the page's links reads as noise.",
    "detectable_from": [
      "screenshot",
      "content-text"
    ],
    "fix_pattern": "Front-load the link with the destination's own terms; the link text should survive being read in isolation.",
    "refs": {
      "wcag": [
        {
          "source_id": "wcag-2.2",
          "citation": "2.4.4 Link Purpose In Context (A)"
        }
      ],
      "other": [
        {
          "source_id": "wcag-2.2",
          "citation": "WCAG failure technique F84"
        },
        {
          "source_id": "gov-uk",
          "citation": "GOV.UK writing guidance: front-load links with relevant terms"
        }
      ]
    },
    "illustration": "Non-evidentiary illustration: 'click here' / 'more' as link text — WCAG failure F84."
  },
  {
    "id": "blank-doorplate",
    "name": "Blank Doorplate",
    "category": "content",
    "standard": "Navigable",
    "definition": "Present when a page title, dialog header, or section label is generic or hardcoded where a specific, contextual name is available — the title does not distinguish this page or state from its siblings.",
    "symptom": "The header describes the category of the thing, not the thing.",
    "detectable_from": [
      "screenshot",
      "source+rendered"
    ],
    "fix_pattern": "Compute the title from the same state the view renders; if the code knows the noun, the header uses it.",
    "refs": {
      "wcag": [
        {
          "source_id": "wcag-2.2",
          "citation": "2.4.2 Page Titled (A)"
        },
        {
          "source_id": "wcag-2.2",
          "citation": "2.4.6 Headings and Labels (AA)"
        }
      ],
      "other": [
        {
          "source_id": "wcag-2.2",
          "citation": "WCAG failure technique F25"
        },
        {
          "source_id": "apple-hig",
          "citation": "Apple HIG: name the action, not the abstraction"
        }
      ]
    },
    "illustration": "Non-evidentiary illustration: a modal header used a hardcoded object name while the same view computed the correct context-specific noun."
  },
  {
    "id": "painted-on-headings",
    "name": "Painted-On Headings",
    "category": "content",
    "standard": "Navigable",